<?xml version="1.0"?>
<!--
To change this license header, choose License Headers in Project Properties.
To change this template file, choose Tools | Templates
and open the template in the editor.
-->

<xs:schema version="1.0"
           xmlns:xs="http://www.w3.org/2001/XMLSchema"
           elementFormDefault="qualified">

    
    

    <xs:simpleType name="date">
        <xs:restriction base="xs:string">
            <xs:pattern value="\d{1,2}/\d{1,2}/\d{1,4}"/>
        </xs:restriction>
    </xs:simpleType>
    
    <xs:simpleType name="name">
        <xs:restriction base="xs:string">
            <xs:pattern value="[A-Z][a-z]+(\s[A-Z][a-z]+)*"/>
           
        </xs:restriction>
    </xs:simpleType>
    

    <xs:simpleType name="email">
        <xs:restriction base="xs:string">
            <xs:pattern value="[A-Za-z_\.]+@[a-z\-][a-z\-]+(\.[a-z\-][a-z\-]+)+"/>
        </xs:restriction>
    </xs:simpleType>

   <xs:simpleType name="userType">
        <xs:restriction base="xs:string">
            <xs:pattern value="[a-z]+"/>
        </xs:restriction>
    </xs:simpleType>

    <xs:simpleType name="password">
        <xs:restriction base="xs:string">
            <xs:pattern value=".+"/>
        </xs:restriction>
    </xs:simpleType>
    
    <xs:simpleType name="subject">
        <xs:restriction base="xs:string">
            <xs:pattern value="[A-Z]{1}[a-zA-Z]+"/>
        </xs:restriction>
    </xs:simpleType>

    <xs:simpleType name="status">
        <xs:restriction base="xs:string">
            <xs:pattern value="[a-z]+"/>
        </xs:restriction>
    </xs:simpleType>
  
    <!-- Insert your element declarations here -->
 
    <xs:element name="tutors"> 
        <xs:complexType>
            <xs:sequence>   
                <xs:element name="tutor" minOccurs="0" maxOccurs="1">
                    <xs:complexType>
                        <xs:sequence>
                            <xs:element name="name" type="name"/>
                            <xs:element name="email" type="email"/>
                            <xs:element name="password" type="password"/>
                            <xs:element name="birthday" type="date"/>
                            <xs:element name="userType" type="usertype"/>     
                            <xs:element name="subject" type="subject"/>
                            <xs:element name="status" type="status"/>                    
                        </xs:sequence>                     
                    </xs:complexType>  
                </xs:element>
           
            </xs:sequence>
        </xs:complexType>   
    </xs:element>
    
    
</xs:schema>
